{
  "schema_version": "agent-context.v2",
  "context_id": "ctx-01",
  "context_hash": "sha256:example",
  "expires_at": "2026-09-22T08:30:00Z",
  "scope": {
    "workspace_id": "workspace-01",
    "research_project_id": "project-01",
    "chain_node_id": "node-01",
    "visibility_scope": "UNIT",
    "scope_kind": "REVIEW",
    "scope_source": "direct_advisor_or_main_pi",
    "policy_version": "research-agent-policy.v1",
    "allowed_tools": ["knowledge.search", "knowledge.list", "file.read"],
    "allowed_plugins": [],
    "allowed_knowledge_base_ids": ["kb-01"],
    "allowed_file_ids": [],
    "policy_id": "plane-node:node-01",
    "policy_hash": "sha256:policy"
  }
}
